Plot,Peristiwa,Dialog,Perasaan,Mon Dalam,Mon Luar,Gambaran,Peribahasa,Frasa Besar
Permulaan,Seekor ikan ajaib bernama Barakuda muncul di muara kampung nelayan.,"""Ibu, kenapa ikan itu bercahaya waktu malam?""",Afiq rasa kagum dan ingin tahu dengan sinar Barakuda.,“Apa sebenarnya rahsia di sebalik ikan ini?”,"""Barakuda! Aku tahu kau ada sesuatu nak tunjukkan!""",Barakuda bersinar kebiruan di bawah cahaya bulan.,Seperti ikan pulang ke lubuk.,Kebangkitan Lautan Nurani
Sub-Konflik,Penduduk kampung mula kehilangan hasil tangkapan secara misteri.,"""Kita patut halau ikan itu dari muara!""",Rakyat kampung dilanda marah dan takut.,“Kenapa semua orang cepat menuduh?”,"""Jangan takut, aku akan selamatkan kalian semua!""","Langit mendung, laut bergelora seperti marah.",Air tenang jangan disangka tiada buaya.,Tuduhan yang Membutakan Akal
Konflik,"Barakuda dituduh sebagai pembawa sial, namun seorang budak bernama Afiq percaya sebaliknya.","""Dia bukan ancaman. Saya yakin dia mahu bantu kita!""",Afiq dihimpit rasa percaya dan waswas.,"“Aku perlu buat sesuatu, walau seorang diri.”","""Inilah kuasa dari dasar laut yang lama dilupakan!""","Kampung nelayan sunyi, hanya angin malam bersuara.","Berani kerana benar, takut kerana salah.",Keyakinan Seorang Remaja
Sub-Kemuncak,Afiq mengikuti Barakuda dan menemui kapal lama di dasar laut yang menyimpan kuasa purba.,"""Barakuda, bawa aku ke kebenaran laut!""",Degup jantungnya kencang saat menyelam ikut Barakuda.,“Ini lebih daripada sekadar ikan.”,"""Kebenaran akan timbul seperti matahari pagi!""","Di dasar laut, batu-batu bersinar menyusun lambang misteri.","Kalau tak dipecahkan ruyung, manakan dapat sagunya.",Panggilan Dasar Samudera
Kemuncak,"Dengan bantuan Barakuda, Afiq berubah menjadi SuperTebar — pelindung laut dan darat.","""Dengan kuasa ini, aku janji lindungi lautan dan daratan!""",Semangat dan keberanian membara dalam diri Afiq.,“Aku bukan budak biasa lagi. Aku pelindung.”,"""Aku SuperTebar, dan laut ini amanahku!""","Langit cerah, petir berkilat saat Afiq muncul bersayap sirip.",Bertepuk sebelah tangan takkan berbunyi.,Lahirnya Wira SuperTebar
Peleraian,SuperTebar menyelamatkan kampung daripada taufan serta mendedahkan penjahat sebenar: pemborong tamak.,"""Taufan akan musnahkan segalanya, tapi aku takkan biarkan!""","Kepuasan, bangga dan syukur bercampur saat kejayaan dicapai.",“Biar aku hadapi semuanya untuk kampung ini.”,"""Pergilah, ribut! Kampung ini takkan rebah!""",Buih laut menyambut kemenangan dalam taufan reda.,"Menang jadi arang, kalah jadi abu.",Kemenangan di Tengah Ribut
Penutup,"Barakuda kembali ke laut dalam, dan Afiq menjadi wira dalam diam, mengajarkan bahawa ikan juga punya nilai luar biasa.","""Dia hanya seekor ikan, tapi ajaranku lebih dalam dari lautan.""",Rasa kehilangan tetapi juga ketenangan hati.,"“Terima kasih, sahabat laut.”","""Dia pergi... tapi pesannya kekal di dada kita.""",Senja menyambut Barakuda pulang ke samudera luas.,"Harimau mati meninggalkan belang, manusia mati meninggalkan nama.",Pesan Seekor Ikan Ajaib
